title,content,date,source
Exploring the Mysteries of Dark Matter,Unraveling the enigma of dark matter and its role in the cosmos.,15-03-23,Astrophysics Today
Innovations in Sustainable Energy,Highlighting the latest breakthroughs in renewable energy technologies.,02-04-23,GreenTech Magazine
The Art of Mindful Living,A guide to incorporating mindfulness into daily life for enhanced well-being.,10-05-23,Mindfulness Journal
Future of Artificial Intelligence,Examining the potential impact and advancements in the field of AI.,22-06-23,Tech Trends Weekly
Culinary Adventures in Fusion Cuisine,Exploring the intersection of diverse culinary traditions in modern gastronomy.,08-07-23,Food & Travel Gazette
Revolutionizing Transportation: Hyperloop,An in-depth look at the Hyperloop technology and its transformative potential in transportation.,17-08-23,Future Transport Review
Discovering Ancient Civilizations,Archaeological findings shedding light on long-lost civilizations around the globe.,05-09-23,"	Archaeology Today"
Space Tourism: A Leap Beyond Earth,Delving into the burgeoning industry of space tourism and its future prospects.,12-10-23,Space Exploration Monthly
The Rise of Quantum Computing,Understanding the principles and applications of quantum computing in the digital age.,03-11-23,Quantum Tech Journal
Human Augmentation: The Next Frontie,Exploring advancements in technologies that enhance human capabilities.,19-12-23,Augmented Humanity Magazine
